{
  "schema_version": "0.1-draft",
  "batch_id": "demo-batch-anomaly-1",
  "sent_at": "2026-09-19T05:30:00.000Z",
  "records": [
    {
      "type": "event",
      "event_id": "demo-event-anomaly-1",
      "occurred_at": "2026-09-19T05:30:00.000Z",
      "mode": "simulation",
      "run_id": "DEMO-RUN-001",
      "tester_id": "grp6-demo-tester",
      "lot_id": "DEMO-LOT-A",
      "wafer_id": "DEMO-W14",
      "site": 2,
      "severity": "warning",
      "kind": "mean_drift",
      "message": "Site 2 最近 32 筆測試結果呈上升趨勢，窗口均值高於示範門檻。",
      "incident_id": "demo-incident-anomaly-1",
      "evidence_ids": [
        "demo-evidence-anomaly-1"
      ],
      "data_quality": "complete"
    },
    {
      "type": "evidence",
      "evidence_id": "demo-evidence-anomaly-1",
      "event_id": "demo-event-anomaly-1",
      "run_id": "DEMO-RUN-001",
      "tester_id": "grp6-demo-tester",
      "lot_id": "DEMO-LOT-A",
      "wafer_id": "DEMO-W14",
      "site": 2,
      "test_name": "Main.subflow3.demo_parametric#CP",
      "unit": "a.u.",
      "sample_count": 32,
      "observed": 1.1225,
      "baseline": 1.01,
      "threshold": 1.08,
      "metric": "mean",
      "series": [
        {
          "index": 1,
          "value": 1.01
        },
        {
          "index": 2,
          "value": 1.02
        },
        {
          "index": 3,
          "value": 1
        },
        {
          "index": 4,
          "value": 1.03
        },
        {
          "index": 5,
          "value": 1.02
        },
        {
          "index": 6,
          "value": 1.04
        },
        {
          "index": 7,
          "value": 1.03
        },
        {
          "index": 8,
          "value": 1.05
        },
        {
          "index": 9,
          "value": 1.04
        },
        {
          "index": 10,
          "value": 1.06
        },
        {
          "index": 11,
          "value": 1.06
        },
        {
          "index": 12,
          "value": 1.08
        },
        {
          "index": 13,
          "value": 1.07
        },
        {
          "index": 14,
          "value": 1.09
        },
        {
          "index": 15,
          "value": 1.08
        },
        {
          "index": 16,
          "value": 1.11
        },
        {
          "index": 17,
          "value": 1.12
        },
        {
          "index": 18,
          "value": 1.1
        },
        {
          "index": 19,
          "value": 1.14
        },
        {
          "index": 20,
          "value": 1.13
        },
        {
          "index": 21,
          "value": 1.16
        },
        {
          "index": 22,
          "value": 1.15
        },
        {
          "index": 23,
          "value": 1.18
        },
        {
          "index": 24,
          "value": 1.2
        },
        {
          "index": 25,
          "value": 1.19
        },
        {
          "index": 26,
          "value": 1.22
        },
        {
          "index": 27,
          "value": 1.23
        },
        {
          "index": 28,
          "value": 1.25
        },
        {
          "index": 29,
          "value": 1.24
        },
        {
          "index": 30,
          "value": 1.27
        },
        {
          "index": 31,
          "value": 1.26
        },
        {
          "index": 32,
          "value": 1.29
        }
      ],
      "missing_fields": []
    },
    {
      "type": "prediction",
      "prediction_id": "demo-prediction-anomaly-1-1",
      "event_id": "demo-event-anomaly-1",
      "run_id": "DEMO-RUN-001",
      "tester_id": "grp6-demo-tester",
      "lot_id": "DEMO-LOT-A",
      "wafer_id": "DEMO-W14",
      "site": 2,
      "device_id": "DEMO-D032",
      "stage": 1,
      "requested_at": "2026-09-19T05:30:00.000Z",
      "predicted": 25.12,
      "actual": 25.14,
      "unit": "°C (示範)",
      "coverage": 1,
      "latency_ms": 1.2,
      "model_version": "demo-only",
      "response_status": "response_queued",
      "tester_receipt_id": null
    },
    {
      "type": "prediction",
      "prediction_id": "demo-prediction-anomaly-1-2",
      "event_id": "demo-event-anomaly-1",
      "run_id": "DEMO-RUN-001",
      "tester_id": "grp6-demo-tester",
      "lot_id": "DEMO-LOT-A",
      "wafer_id": "DEMO-W14",
      "site": 2,
      "device_id": "DEMO-D032",
      "stage": 2,
      "requested_at": "2026-09-19T05:30:00.000Z",
      "predicted": 25.31,
      "actual": 25.29,
      "unit": "°C (示範)",
      "coverage": 1,
      "latency_ms": 1.4,
      "model_version": "demo-only",
      "response_status": "response_queued",
      "tester_receipt_id": null
    },
    {
      "type": "prediction",
      "prediction_id": "demo-prediction-anomaly-1-3",
      "event_id": "demo-event-anomaly-1",
      "run_id": "DEMO-RUN-001",
      "tester_id": "grp6-demo-tester",
      "lot_id": "DEMO-LOT-A",
      "wafer_id": "DEMO-W14",
      "site": 2,
      "device_id": "DEMO-D032",
      "stage": 3,
      "requested_at": "2026-09-19T05:30:00.000Z",
      "predicted": 25.49,
      "actual": 25.51,
      "unit": "°C (示範)",
      "coverage": 1,
      "latency_ms": 1.1,
      "model_version": "demo-only",
      "response_status": "response_queued",
      "tester_receipt_id": null
    },
    {
      "type": "prediction",
      "prediction_id": "demo-prediction-anomaly-1-4",
      "event_id": "demo-event-anomaly-1",
      "run_id": "DEMO-RUN-001",
      "tester_id": "grp6-demo-tester",
      "lot_id": "DEMO-LOT-A",
      "wafer_id": "DEMO-W14",
      "site": 2,
      "device_id": "DEMO-D032",
      "stage": 4,
      "requested_at": "2026-09-19T05:30:00.000Z",
      "predicted": 25.66,
      "actual": 25.64,
      "unit": "°C (示範)",
      "coverage": 1,
      "latency_ms": 1.6,
      "model_version": "demo-only",
      "response_status": "response_queued",
      "tester_receipt_id": null
    },
    {
      "type": "prediction",
      "prediction_id": "demo-prediction-anomaly-1-5",
      "event_id": "demo-event-anomaly-1",
      "run_id": "DEMO-RUN-001",
      "tester_id": "grp6-demo-tester",
      "lot_id": "DEMO-LOT-A",
      "wafer_id": "DEMO-W14",
      "site": 2,
      "device_id": "DEMO-D032",
      "stage": 5,
      "requested_at": "2026-09-19T05:30:00.000Z",
      "predicted": 25.87,
      "actual": 25.9,
      "unit": "°C (示範)",
      "coverage": 1,
      "latency_ms": 1.3,
      "model_version": "demo-only",
      "response_status": "response_queued",
      "tester_receipt_id": null
    },
    {
      "type": "prediction",
      "prediction_id": "demo-prediction-anomaly-1-6",
      "event_id": "demo-event-anomaly-1",
      "run_id": "DEMO-RUN-001",
      "tester_id": "grp6-demo-tester",
      "lot_id": "DEMO-LOT-A",
      "wafer_id": "DEMO-W14",
      "site": 2,
      "device_id": "DEMO-D032",
      "stage": 6,
      "requested_at": "2026-09-19T05:30:00.000Z",
      "predicted": 26.05,
      "actual": 26.02,
      "unit": "°C (示範)",
      "coverage": 1,
      "latency_ms": 1.5,
      "model_version": "demo-only",
      "response_status": "response_queued",
      "tester_receipt_id": null
    },
    {
      "type": "incident",
      "incident_id": "demo-incident-anomaly-1",
      "run_id": "DEMO-RUN-001",
      "tester_id": "grp6-demo-tester",
      "lot_id": "DEMO-LOT-A",
      "wafer_id": "DEMO-W14",
      "site": 2,
      "title": "Site 2 測試均值持續上升",
      "status": "open",
      "severity": "warning",
      "event_ids": [
        "demo-event-anomaly-1"
      ],
      "evidence_ids": [
        "demo-evidence-anomaly-1"
      ],
      "first_seen": "2026-09-19T05:30:00.000Z"
    }
  ]
}
