{
  "schema_version": "0.1-draft",
  "batch_id": "demo-batch-missing-1",
  "sent_at": "2026-09-19T05:30:00.000Z",
  "records": [
    {
      "type": "event",
      "event_id": "demo-event-missing-1",
      "occurred_at": "2026-09-19T05:30:00.000Z",
      "mode": "simulation",
      "run_id": "DEMO-RUN-001",
      "tester_id": "grp6-demo-tester",
      "lot_id": "DEMO-LOT-A",
      "wafer_id": "DEMO-W14",
      "site": 2,
      "severity": "info",
      "kind": "missing_data",
      "message": "第 3 階段預測缺少 8 個輸入特徵，本次不產生預測值。",
      "incident_id": null,
      "evidence_ids": [
        "demo-evidence-missing-1"
      ],
      "data_quality": "partial"
    },
    {
      "type": "evidence",
      "evidence_id": "demo-evidence-missing-1",
      "event_id": "demo-event-missing-1",
      "run_id": "DEMO-RUN-001",
      "tester_id": "grp6-demo-tester",
      "lot_id": "DEMO-LOT-A",
      "wafer_id": "DEMO-W14",
      "site": 2,
      "test_name": "Main.subflow3.demo_parametric#CP",
      "unit": "ratio",
      "sample_count": 24,
      "observed": 0.75,
      "baseline": 1,
      "threshold": 1,
      "metric": "coverage",
      "series": [],
      "missing_fields": [
        "demo_feature_25",
        "demo_feature_26",
        "demo_feature_27",
        "demo_feature_28",
        "demo_feature_29",
        "demo_feature_30",
        "demo_feature_31",
        "demo_feature_32"
      ]
    },
    {
      "type": "prediction",
      "prediction_id": "demo-prediction-missing-1-1",
      "event_id": "demo-event-missing-1",
      "run_id": "DEMO-RUN-001",
      "tester_id": "grp6-demo-tester",
      "lot_id": "DEMO-LOT-A",
      "wafer_id": "DEMO-W14",
      "site": 2,
      "device_id": "DEMO-D032",
      "stage": 1,
      "requested_at": "2026-09-19T05:30:00.000Z",
      "predicted": null,
      "actual": null,
      "unit": "°C (示範)",
      "coverage": 0,
      "latency_ms": null,
      "model_version": "demo-only",
      "response_status": "not_requested",
      "tester_receipt_id": null
    },
    {
      "type": "prediction",
      "prediction_id": "demo-prediction-missing-1-2",
      "event_id": "demo-event-missing-1",
      "run_id": "DEMO-RUN-001",
      "tester_id": "grp6-demo-tester",
      "lot_id": "DEMO-LOT-A",
      "wafer_id": "DEMO-W14",
      "site": 2,
      "device_id": "DEMO-D032",
      "stage": 2,
      "requested_at": "2026-09-19T05:30:00.000Z",
      "predicted": null,
      "actual": null,
      "unit": "°C (示範)",
      "coverage": 0,
      "latency_ms": null,
      "model_version": "demo-only",
      "response_status": "not_requested",
      "tester_receipt_id": null
    },
    {
      "type": "prediction",
      "prediction_id": "demo-prediction-missing-1-3",
      "event_id": "demo-event-missing-1",
      "run_id": "DEMO-RUN-001",
      "tester_id": "grp6-demo-tester",
      "lot_id": "DEMO-LOT-A",
      "wafer_id": "DEMO-W14",
      "site": 2,
      "device_id": "DEMO-D032",
      "stage": 3,
      "requested_at": "2026-09-19T05:30:00.000Z",
      "predicted": null,
      "actual": null,
      "unit": "°C (示範)",
      "coverage": 0.75,
      "latency_ms": null,
      "model_version": "demo-only",
      "response_status": "insufficient_data",
      "tester_receipt_id": null
    },
    {
      "type": "prediction",
      "prediction_id": "demo-prediction-missing-1-4",
      "event_id": "demo-event-missing-1",
      "run_id": "DEMO-RUN-001",
      "tester_id": "grp6-demo-tester",
      "lot_id": "DEMO-LOT-A",
      "wafer_id": "DEMO-W14",
      "site": 2,
      "device_id": "DEMO-D032",
      "stage": 4,
      "requested_at": "2026-09-19T05:30:00.000Z",
      "predicted": null,
      "actual": null,
      "unit": "°C (示範)",
      "coverage": 0,
      "latency_ms": null,
      "model_version": "demo-only",
      "response_status": "not_requested",
      "tester_receipt_id": null
    },
    {
      "type": "prediction",
      "prediction_id": "demo-prediction-missing-1-5",
      "event_id": "demo-event-missing-1",
      "run_id": "DEMO-RUN-001",
      "tester_id": "grp6-demo-tester",
      "lot_id": "DEMO-LOT-A",
      "wafer_id": "DEMO-W14",
      "site": 2,
      "device_id": "DEMO-D032",
      "stage": 5,
      "requested_at": "2026-09-19T05:30:00.000Z",
      "predicted": null,
      "actual": null,
      "unit": "°C (示範)",
      "coverage": 0,
      "latency_ms": null,
      "model_version": "demo-only",
      "response_status": "not_requested",
      "tester_receipt_id": null
    },
    {
      "type": "prediction",
      "prediction_id": "demo-prediction-missing-1-6",
      "event_id": "demo-event-missing-1",
      "run_id": "DEMO-RUN-001",
      "tester_id": "grp6-demo-tester",
      "lot_id": "DEMO-LOT-A",
      "wafer_id": "DEMO-W14",
      "site": 2,
      "device_id": "DEMO-D032",
      "stage": 6,
      "requested_at": "2026-09-19T05:30:00.000Z",
      "predicted": null,
      "actual": null,
      "unit": "°C (示範)",
      "coverage": 0,
      "latency_ms": null,
      "model_version": "demo-only",
      "response_status": "not_requested",
      "tester_receipt_id": null
    }
  ]
}
