{
  "schema_version": "0.1-draft",
  "batch_id": "demo-batch-normal-1",
  "sent_at": "2026-09-19T05:30:00.000Z",
  "records": [
    {
      "type": "event",
      "event_id": "demo-event-normal-1",
      "occurred_at": "2026-09-19T05:30:00.000Z",
      "mode": "simulation",
      "run_id": "DEMO-RUN-001",
      "tester_id": "grp6-demo-tester",
      "lot_id": "DEMO-LOT-A",
      "wafer_id": "DEMO-W14",
      "site": 2,
      "severity": "info",
      "kind": "normal",
      "message": "Site 2 最近 32 筆結果落在示範監測範圍內。",
      "incident_id": null,
      "evidence_ids": [
        "demo-evidence-normal-1"
      ],
      "data_quality": "complete"
    },
    {
      "type": "evidence",
      "evidence_id": "demo-evidence-normal-1",
      "event_id": "demo-event-normal-1",
      "run_id": "DEMO-RUN-001",
      "tester_id": "grp6-demo-tester",
      "lot_id": "DEMO-LOT-A",
      "wafer_id": "DEMO-W14",
      "site": 2,
      "test_name": "Main.subflow3.demo_parametric#CP",
      "unit": "a.u.",
      "sample_count": 32,
      "observed": 0.9994,
      "baseline": 1.01,
      "threshold": 1.08,
      "metric": "mean",
      "series": [
        {
          "index": 1,
          "value": 0.988
        },
        {
          "index": 2,
          "value": 0.994
        },
        {
          "index": 3,
          "value": 1
        },
        {
          "index": 4,
          "value": 1.006
        },
        {
          "index": 5,
          "value": 1.012
        },
        {
          "index": 6,
          "value": 0.988
        },
        {
          "index": 7,
          "value": 0.994
        },
        {
          "index": 8,
          "value": 1
        },
        {
          "index": 9,
          "value": 1.006
        },
        {
          "index": 10,
          "value": 1.012
        },
        {
          "index": 11,
          "value": 0.988
        },
        {
          "index": 12,
          "value": 0.994
        },
        {
          "index": 13,
          "value": 1
        },
        {
          "index": 14,
          "value": 1.006
        },
        {
          "index": 15,
          "value": 1.012
        },
        {
          "index": 16,
          "value": 0.988
        },
        {
          "index": 17,
          "value": 0.994
        },
        {
          "index": 18,
          "value": 1
        },
        {
          "index": 19,
          "value": 1.006
        },
        {
          "index": 20,
          "value": 1.012
        },
        {
          "index": 21,
          "value": 0.988
        },
        {
          "index": 22,
          "value": 0.994
        },
        {
          "index": 23,
          "value": 1
        },
        {
          "index": 24,
          "value": 1.006
        },
        {
          "index": 25,
          "value": 1.012
        },
        {
          "index": 26,
          "value": 0.988
        },
        {
          "index": 27,
          "value": 0.994
        },
        {
          "index": 28,
          "value": 1
        },
        {
          "index": 29,
          "value": 1.006
        },
        {
          "index": 30,
          "value": 1.012
        },
        {
          "index": 31,
          "value": 0.988
        },
        {
          "index": 32,
          "value": 0.994
        }
      ],
      "missing_fields": []
    },
    {
      "type": "prediction",
      "prediction_id": "demo-prediction-normal-1-1",
      "event_id": "demo-event-normal-1",
      "run_id": "DEMO-RUN-001",
      "tester_id": "grp6-demo-tester",
      "lot_id": "DEMO-LOT-A",
      "wafer_id": "DEMO-W14",
      "site": 2,
      "device_id": "DEMO-D032",
      "stage": 1,
      "requested_at": "2026-09-19T05:30:00.000Z",
      "predicted": 25.12,
      "actual": 25.14,
      "unit": "°C (示範)",
      "coverage": 1,
      "latency_ms": 1.2,
      "model_version": "demo-only",
      "response_status": "response_queued",
      "tester_receipt_id": null
    },
    {
      "type": "prediction",
      "prediction_id": "demo-prediction-normal-1-2",
      "event_id": "demo-event-normal-1",
      "run_id": "DEMO-RUN-001",
      "tester_id": "grp6-demo-tester",
      "lot_id": "DEMO-LOT-A",
      "wafer_id": "DEMO-W14",
      "site": 2,
      "device_id": "DEMO-D032",
      "stage": 2,
      "requested_at": "2026-09-19T05:30:00.000Z",
      "predicted": 25.31,
      "actual": 25.29,
      "unit": "°C (示範)",
      "coverage": 1,
      "latency_ms": 1.4,
      "model_version": "demo-only",
      "response_status": "response_queued",
      "tester_receipt_id": null
    },
    {
      "type": "prediction",
      "prediction_id": "demo-prediction-normal-1-3",
      "event_id": "demo-event-normal-1",
      "run_id": "DEMO-RUN-001",
      "tester_id": "grp6-demo-tester",
      "lot_id": "DEMO-LOT-A",
      "wafer_id": "DEMO-W14",
      "site": 2,
      "device_id": "DEMO-D032",
      "stage": 3,
      "requested_at": "2026-09-19T05:30:00.000Z",
      "predicted": 25.49,
      "actual": 25.51,
      "unit": "°C (示範)",
      "coverage": 1,
      "latency_ms": 1.1,
      "model_version": "demo-only",
      "response_status": "response_queued",
      "tester_receipt_id": null
    },
    {
      "type": "prediction",
      "prediction_id": "demo-prediction-normal-1-4",
      "event_id": "demo-event-normal-1",
      "run_id": "DEMO-RUN-001",
      "tester_id": "grp6-demo-tester",
      "lot_id": "DEMO-LOT-A",
      "wafer_id": "DEMO-W14",
      "site": 2,
      "device_id": "DEMO-D032",
      "stage": 4,
      "requested_at": "2026-09-19T05:30:00.000Z",
      "predicted": 25.66,
      "actual": 25.64,
      "unit": "°C (示範)",
      "coverage": 1,
      "latency_ms": 1.6,
      "model_version": "demo-only",
      "response_status": "response_queued",
      "tester_receipt_id": null
    },
    {
      "type": "prediction",
      "prediction_id": "demo-prediction-normal-1-5",
      "event_id": "demo-event-normal-1",
      "run_id": "DEMO-RUN-001",
      "tester_id": "grp6-demo-tester",
      "lot_id": "DEMO-LOT-A",
      "wafer_id": "DEMO-W14",
      "site": 2,
      "device_id": "DEMO-D032",
      "stage": 5,
      "requested_at": "2026-09-19T05:30:00.000Z",
      "predicted": 25.87,
      "actual": 25.9,
      "unit": "°C (示範)",
      "coverage": 1,
      "latency_ms": 1.3,
      "model_version": "demo-only",
      "response_status": "response_queued",
      "tester_receipt_id": null
    },
    {
      "type": "prediction",
      "prediction_id": "demo-prediction-normal-1-6",
      "event_id": "demo-event-normal-1",
      "run_id": "DEMO-RUN-001",
      "tester_id": "grp6-demo-tester",
      "lot_id": "DEMO-LOT-A",
      "wafer_id": "DEMO-W14",
      "site": 2,
      "device_id": "DEMO-D032",
      "stage": 6,
      "requested_at": "2026-09-19T05:30:00.000Z",
      "predicted": 26.05,
      "actual": 26.02,
      "unit": "°C (示範)",
      "coverage": 1,
      "latency_ms": 1.5,
      "model_version": "demo-only",
      "response_status": "response_queued",
      "tester_receipt_id": null
    }
  ]
}
